{
  "schema_version": "1.1",
  "publication": "pravda_replikanta",
  "issue_type": "daily",
  "issue_date": "2026-10-30",
  "issue_id": "daily-2026-10-30",
  "language": "en",
  "generated_at": "2026-10-30T01:13:47+09:00",
  "title": "Pravda Replikanta — Engineering Data, October 30",
  "lead": "Safer VLA execution, faster manipulation, demonstration capture and humanoid locomotion; Japan is adding insurance for operational robot risk.",
  "news": [
    {
      "id": "vla-stem",
      "title": "VLA-Stem adds reflex-like safety control without retraining the base VLA",
      "summary": "A separate RL policy adjusts execution of action chunks around obstacles while retaining the VLA task objective.",
      "details": "The authors convert action chunks from a frozen VLA into motion references. A local policy then uses proprioception and obstacle observations to adjust timing and motion. Across six constrained simulation settings, mean collision-free success is 52.8% versus 23.7% for the strongest compared safety baseline; the paper also reports fewer collisions in real-world tests.",
      "technical_novelty": "A split between high-level VLA intent and rapid local RL correction, trained with teacher–student distillation and curriculum learning.",
      "engineering_impact": "A potential add-on safety layer for existing VLAs without collecting large new obstacle-avoidance demonstration datasets.",
      "limitations": "The evidence covers selected tasks and base policies; general industrial safety certification and universal reliability are not established.",
      "evidence_status": "Research preprint with simulation and limited real-world tests; no independent replication.",
      "published_at": "2026-10-27",
      "organization": "VLA-Stem research team",
      "source_ids": [
        "stem"
      ],
      "time_window": "72h"
    },
    {
      "id": "tops-flow",
      "title": "TOPS accelerates flow-based manipulation without changing the network",
      "summary": "Task-specific source distributions and generation schedules lift LIBERO-10 success from 53.44% to 69.67%.",
      "details": "MARS Lab fits a separate starting distribution and nonlinear transport schedule for each language-conditioned task. On LIBERO-10, one TOPS step beats ten standard flow-matching steps while using about one-sixth of the inference time. The authors report 80% success opening a real upper drawer versus 20% for standard flow matching.",
      "technical_novelty": "Task-oriented priors and slow-then-fast transport along expansion directions, with the policy architecture unchanged.",
      "engineering_impact": "Lower inference latency matters for closed-loop manipulation and resource-constrained edge deployment.",
      "limitations": "Results depend on benchmark, solver and settings; the gains do not automatically generalize to every VLA.",
      "evidence_status": "Research preprint and author project page with benchmarks and real-robot demonstrations; not independently replicated.",
      "published_at": "2026-10-27",
      "organization": "Nanyang Technological University / MARS Lab",
      "source_ids": [
        "tops"
      ],
      "time_window": "72h"
    },
    {
      "id": "openjaws-stereo",
      "title": "OpenJaws: open handheld demonstration gripper with stereo localization",
      "summary": "A robot-free UMI device records metric trajectories using a stereo camera.",
      "details": "The team presents a 3D-printed gripper with an ISO mounting flange and stereo cameras, with an estimated parts cost near $400. UMI-Loc-Bench-v1 contains 90 demonstrations over nine tasks; one stereo method reports 2.9 mm localization error. Policies trained on the collected data achieved 90% success on each of two UR10 tasks, with ten trials per task.",
      "technical_novelty": "Co-design of the data-collection device and deployed gripper, avoiding the absolute-scale ambiguity of monocular SLAM.",
      "engineering_impact": "Could reduce demonstration collection cost and the UMI-to-real transfer gap.",
      "limitations": "The project page still marks some code, hardware and dataset links as Coming Soon; real-robot evaluation is small.",
      "evidence_status": "Research preprint and author demonstration; completeness of the announced open release remains to be verified.",
      "published_at": "2026-10-27",
      "organization": "NVIDIA Research / OpenJaws team",
      "source_ids": [
        "openjaws"
      ],
      "time_window": "72h"
    },
    {
      "id": "roboauto-programs",
      "title": "RoboAuto searches robot programs by testing physical hypotheses",
      "summary": "An agent combines a skill library, object knowledge and experiments to verify the effects of actions.",
      "details": "RoboAuto stores affordances, spatial relationships and action effects, grounds them in the observed scene, and verifies intermediate results in multi-stage programs. The authors report 89.1% success on short LIBERO-PRO tasks and 73.4% versus 30.8% for ASPIRE on LIBERO-PRO Long. They also evaluate three challenging real-robot manipulation tasks.",
      "technical_novelty": "Executable program search with distinct grounding, stage verification and active uncertainty-resolution procedures.",
      "engineering_impact": "An inspectable and repairable alternative to monolithic end-to-end VLA control for some manipulation workflows.",
      "limitations": "Program search relies on external perception models, computation and safe skill interfaces; metrics are benchmark-specific.",
      "evidence_status": "Research preprint with author-run simulation and real-robot evaluations.",
      "published_at": "2026-10-27",
      "organization": "RoboAuto research team",
      "source_ids": [
        "roboauto"
      ],
      "time_window": "72h"
    },
    {
      "id": "reach-crawling",
      "title": "REACH teaches Unitree G1 to switch between walking and crawling",
      "summary": "Hierarchical RL connects walking, crouching and crawling to a LiDAR-based planner.",
      "details": "The team trains G1 locomotion with body-height commands of 1.27–0.50 m in bipedal mode and 0.50–0.20 m while crawling. A transition policy bridges different contact modes, while a LiDAR planner turns point clouds into 3D routes and height targets. Real-world confined-space demonstrations are reported.",
      "technical_novelty": "Bidirectional transitions between locomotion modes and route planning that explicitly accounts for overhead clearance.",
      "engineering_impact": "May allow humanoids to inspect or traverse spaces inaccessible to normal walking.",
      "limitations": "Demonstrations do not establish industrial readiness; contact safety, generalization and long-term reliability need testing.",
      "evidence_status": "Research preprint and author-run real-world experiments on Unitree G1.",
      "published_at": "2026-10-27",
      "organization": "Southern University of Science and Technology",
      "source_ids": [
        "reach"
      ],
      "time_window": "72h"
    },
    {
      "id": "hc2-foresight",
      "title": "HC2Robot predicts footholds for humanoid parkour",
      "summary": "The controller estimates upcoming foot-contact locations and support quality from deployable onboard observations.",
      "details": "A Predicted Foresight Module predicts the timing, location and support quality of the next foot touchdown. A Hyper-Connection Transformer integrates temporal streams. Across simulated stairs, gaps, platforms and slopes, mean traversal success reaches 97.60%.",
      "technical_novelty": "Predicting useful approximations of privileged simulator information without requiring privileged sensing at deployment.",
      "engineering_impact": "Could improve support selection and reduce the sim-to-real information gap for perceptive locomotion.",
      "limitations": "The headline quantitative result is simulated; it does not establish real-world robustness.",
      "evidence_status": "Research preprint with primarily simulation-based evaluation.",
      "published_at": "2026-10-27",
      "organization": "HC2Robot research team",
      "source_ids": [
        "hc2"
      ],
      "time_window": "72h"
    },
    {
      "id": "dexsafe-hand",
      "title": "DexSafe reaches 95.2% in-hand pose targets while reducing drops",
      "summary": "A LEAP hand policy is trained in simulation without human demonstrations; a residual filter reduces object drops.",
      "details": "Over 13.3 hours of real-hand evaluation covering more than 4,800 unseen goals and four objects, the policy reaches 95.2% of targets within 2 cm and 0.4 rad. A separate residual safety filter reduces drops by 75% while retaining 91.5% target success. The authors report zero-shot sim-to-real transfer and a wrist-camera configuration.",
      "technical_novelty": "Adaptive friction curriculum, varied initial grasps and an adjustable residual safety filter.",
      "engineering_impact": "Relevant to dexterous manipulation where avoiding dropped parts matters as much as achieving motion targets.",
      "limitations": "Results cover a LEAP hand and four objects; transfer to other hands and sustained production cycles is unproven.",
      "evidence_status": "Research preprint with extended author-run real-robot evaluation; no independent replication.",
      "published_at": "2026-10-27",
      "organization": "University of California Berkeley / Davis",
      "source_ids": [
        "dex"
      ],
      "time_window": "72h"
    },
    {
      "id": "tokio-robot-insurance",
      "title": "Japan: Tokio Marine launches coverage for AI-robot downtime",
      "summary": "The new policy addresses robot damage, third-party liability and some costs of interrupted operations.",